URL,Title,Description
https://ddos-guard.ru/,DDoS-Guard | Российский сервис защиты от DDoS-атак,Защищаем от DDoS-атак компании любого уровня. ✔️ Фиксированные цены на anti-DDoS услуги без доплат. ✔️ Более 500 000 проектов уже под защитой DDoS-Guard
https://ddos-guard.ru/web-protection,Защита от DDoS-атак для сайтов любого уровня | DDoS-Guard,Надежная защита от DDoS атак на уровне L7 для сайтов без смены хостинга. ✔️ CDN на всех тарифах. ✔️ Уникальные модули защиты. ✔️ Бесплатный тест от 3-х дней
https://ddos-guard.ru/network-protection,Защита от DDoS-атак сетевой инфраструктуры | DDoS-Guard,Непрерывная защита от DDoS-атак на уровнях L3-4 для компаний с собственной сетевой инфраструктурой. ✔️Два типа фильтрации. ✔️Различные способы интеграций. ✔️Уникальные опции защиты
https://ddos-guard.ru/hosting,Хостинг с защитой от DDoS-атак | DDoS-Guard,Защищенный хостинг на серверах DDoS-Guard для небольших веб-проектов. ✔️ Автоматическая защита от DDoS-атак. ✔️ CDN на всех тарифах. ✔️ Многоканальная техподдержка
https://ddos-guard.ru/vds-vps,VDS/VPS: виртуальные серверы с защитой от DDoS | DDoS-Guard,Защищенные виртуальные серверы для веб-проектов с высокой нагрузкой по трафику. ✔️ Автоматическая защита от DDoS-атак. ✔️ CDN на всех тарифах. ✔️ Многоканальная техподдержка
https://ddos-guard.ru/server,Выделенные серверы с защитой от DDoS-атак | DDoS-Guard,Мощные физические серверы в аренду для высоконагруженных веб-проектов. ✔️ Автоматическая защита от DDoS-атак. ✔️ CDN на всех тарифах. ✔️ ЦОД уровня Tier III
https://ddos-guard.ru/security-audit,Анализ защищенности и пентест | DDoS-Guard,Анализ защищенности информационных систем с пентестом от экспертов DDoS-Guard. Проверьте готовность вашего проекта к киберугрозам
https://ddos-guard.ru/ori,Обработка ключей шифрования для ОРИ | DDoS-Guard,"Разрабатываем под ключ решения по хранению, обработке и передаче данных для организаторов распространения информации, согласно ФЗ №97 от 2014 года"
https://ddos-guard.ru/bot-mitigation,Модуль защиты от ботов для сайтов | DDoS-Guard,Дополнительный модуль Bot Mitigation против вредоносных ботов на сайте. Подключите вместе с базовыми услугами защиты DDoS-Guard
https://ddos-guard.ru/waf,Модуль Web Application Firewall (WAF) | DDoS-Guard,Отслеживайте попытки вредоносного вторжения и получайте подробную аналитику с дополнительной опцией — DDoS-Guard Web Application Firewall (WAF)
